{
  "$schema": "https://json-schema.org/draft/2020-12/schema",
  "$id": "https://webuildconsortium.eu/schemas/ownership-sd-jwt.json",
  "title": "WeBuild – Ownership Attestation (Ownership) – SD-JWT VC payload",
  "description": "Schema for the SD-JWT VC payload of an Ownership attestation as defined in the Ownership Rulebook (Chapter 3.2). This models the JSON claims set prior to SD-JWT disclosure/packing. The Ownership records all natural and legal persons holding direct or indirect ownership in a legal entity, providing comprehensive transparency on beneficial ownership structures and economic interests in support of KYC/KYS processes and AML obligations.",
  "type": "object",
  "version": "0.1.0",
  "additionalProperties": true,
  "properties": {
    "vct": {
      "type": "string",
      "description": "Verifiable Credential Type. Base type is 'eu.we-build.ownership.1'.",
      "examples": [
        "eu.we-build.ownership.1"
      ]
    },
    "iss": {
      "type": "string",
      "description": "Identifier of the entity that issued the attestation (URI or DID). SHALL NOT be selectively disclosable. Per RFC 7519.",
      "examples": [
        "https://issuer.example.com",
        "did:example:legal-entity-789"
      ]
    },
    "iat": {
      "type": "integer",
      "description": "Issuance date and time as a Unix timestamp (seconds since epoch). SHALL NOT be selectively disclosable. Per RFC 7519.",
      "examples": [
        1736935200
      ]
    },
    "exp": {
      "type": "integer",
      "description": "Expiry date and time as a Unix timestamp (seconds since epoch). SHALL NOT be selectively disclosable. Per RFC 7519.",
      "examples": [
        1768471200
      ]
    },
    "attestation_legal_category": {
      "type": "string",
      "description": "The legal category of the attestation as defined by eIDAS 2. For Ownership attestations this SHALL be 'EAA', as the attestation is typically self-issued by the legal entity subject to the ownership disclosure.",
      "enum": [
        "EAA"
      ]
    },
    "issuing_entity": {
      "type": "string",
      "description": "The identifier of the legal entity that issued the attestation. For Ownership attestations this is typically the subject entity itself (self-issued EAA).",
      "examples": [
        "did:example:legal-entity-123"
      ]
    },
    "owner": {
      "type": "array",
      "description": "Array of owner objects (either natural person or legal person). SHALL contain at least one natural person owner to comply with AML requirements that mandate identification of natural persons who ultimately own the entity.",
      "minItems": 1,
      "items": {
        "type": "object",
        "description": "A single owner entry. The 'type' field identifies whether the owner is a natural person (NP) or a legal entity (LE). Each owner entry includes identity attributes, address, and at least one ownership record.",
        "additionalProperties": false,
        "required": [
          "type",
          "address",
          "ownership"
        ],
        "oneOf": [
          {
            "required": ["natural_person"],
            "properties": {
              "type": { "const": "NP" }
            }
          },
          {
            "required": ["legal_person"],
            "properties": {
              "type": { "const": "LE" }
            }
          }
        ],
        "properties": {
          "type": {
            "type": "string",
            "description": "Indicates whether the owner is a natural person (NP) or a legal entity (LE). SHALL be non-empty.",
            "enum": [
              "NP",
              "LE"
            ]
          },
          "natural_person": {
            "type": "object",
            "description": "Details of a natural person owner. Required when type is 'NP'.",
            "additionalProperties": false,
            "required": [
              "first_name",
              "surname",
              "date_of_birth"
            ],
            "properties": {
              "first_name": {
                "type": "string",
                "minLength": 1,
                "description": "First name(s), including middle name(s) where applicable, of the natural person who holds ownership or control. SHALL be a non-empty string."
              },
              "surname": {
                "type": "string",
                "minLength": 1,
                "description": "Last name(s) or surname(s) of the natural person who holds ownership or control. SHALL be a non-empty string."
              },
              "date_of_birth": {
                "type": "string",
                "format": "date",
                "description": "Day, month, and year of birth of the natural person. SHALL follow ISO 8601 format (YYYY-MM-DD)."
              }
            }
          },
          "legal_person": {
            "type": "object",
            "description": "Details of a legal person (entity) owner. Required when type is 'LE'.",
            "additionalProperties": false,
            "required": [
              "legal_name",
              "legal_form",
              "identifier"
            ],
            "properties": {
              "legal_name": {
                "type": "string",
                "minLength": 1,
                "description": "The complete official name of the legal entity which holds ownership interests in the subject entity. SHALL be a non-empty string."
              },
              "legal_form": {
                "type": "string",
                "minLength": 1,
                "description": "The legal form of the owning legal entity (e.g., GmbH, AG, Ltd, SA, BV). SHALL be a non-empty string."
              },
              "identifier": {
                "type": "object",
                "description": "The identification of the legal entity which owns this entity. At least one identifier (euid, lei, or tax) must be specified.",
                "additionalProperties": false,
                "minProperties": 1,
                "properties": {
                  "euid": {
                    "type": "string",
                    "description": "European Unique Identifier (EUID) per ISO 3166-1 alpha-2. Optional.",
                    "examples": [
                      "DE/HRB/123456"
                    ]
                  },
                  "lei": {
                    "type": "string",
                    "description": "Legal Entity Identifier (LEI) per ISO 17442. Optional.",
                    "pattern": "^[A-Z0-9]{20}$"
                  },
                  "tax": {
                    "type": "string",
                    "description": "Tax Number or national company registration number. Optional."
                  }
                }
              }
            }
          },
          "address": {
            "type": "object",
            "description": "Address of the owner. For natural persons this is the residence address; for legal persons this is the registered address. All sub-fields are mandatory per the Rulebook data model.",
            "additionalProperties": false,
            "required": [
              "street",
              "house_number",
              "locality",
              "region",
              "postal_code",
              "country"
            ],
            "properties": {
              "street": {
                "type": "string",
                "minLength": 1,
                "description": "Street name of the address. SHALL be non-empty."
              },
              "house_number": {
                "type": "string",
                "minLength": 1,
                "description": "House or building number of the address. SHALL be non-empty."
              },
              "locality": {
                "type": "string",
                "minLength": 1,
                "description": "City or locality of the address. SHALL be non-empty."
              },
              "region": {
                "type": "string",
                "minLength": 1,
                "description": "State, province, or region of the address. SHALL be non-empty."
              },
              "postal_code": {
                "type": "string",
                "minLength": 1,
                "description": "Postal or ZIP code of the address. SHALL be non-empty."
              },
              "country": {
                "type": "string",
                "description": "ISO 3166-1 alpha-2 country code of the address. SHALL be non-empty.",
                "pattern": "^[A-Z]{2}$"
              }
            }
          },
          "ownership": {
            "type": "array",
            "description": "Array of ownership records for this owner. At least one ownership record SHALL be present per owner entry.",
            "minItems": 1,
            "items": {
              "type": "object",
              "description": "A single ownership record describing the ownership interest held by this owner.",
              "additionalProperties": false,
              "required": [
                "legal_identifier",
                "type",
                "stake",
                "amount",
                "category",
                "economic_rights"
              ],
              "properties": {
                "legal_identifier": {
                  "type": "string",
                  "minLength": 1,
                  "description": "The identifier of the owned entity (e.g., EUID, LEI, or national registration number). SHALL be non-empty."
                },
                "type": {
                  "type": "string",
                  "description": "Type of ownership interest. SHALL use one of the standardized values: 'direct' or 'indirect', as defined in Section 2.8.2 of the Ownership Rulebook.",
                  "enum": [
                    "direct",
                    "indirect"
                  ]
                },
                "stake": {
                  "description": "The percentage of ownership held (0–100) as a decimal, or a rule string where the exact percentage is not determinable. SHALL be non-empty.",
                  "oneOf": [
                    {
                      "type": "number",
                      "minimum": 0,
                      "maximum": 100,
                      "description": "Percentage of ownership as a decimal value between 0.00 and 100.00 (inclusive)."
                    },
                    {
                      "type": "string",
                      "minLength": 1,
                      "description": "Rule string describing the ownership stake where exact percentage is not determinable."
                    }
                  ]
                },
                "amount": {
                  "description": "Nominal monetary value of the ownership interest, or null where nominal value is not applicable or not available.",
                  "oneOf": [
                    {
                      "type": "object",
                      "description": "Nominal value and currency of the ownership stake.",
                      "additionalProperties": false,
                      "required": [
                        "value",
                        "currency"
                      ],
                      "properties": {
                        "value": {
                          "description": "Nominal value of the ownership stake, or null if not applicable.",
                          "oneOf": [
                            {
                              "type": "number",
                              "minimum": 0,
                              "description": "Nominal monetary value."
                            },
                            {
                              "type": "null",
                              "description": "Null where nominal value is not applicable."
                            }
                          ]
                        },
                        "currency": {
                          "description": "ISO 4217 currency code for the nominal value, or null if not applicable.",
                          "oneOf": [
                            {
                              "type": "string",
                              "pattern": "^[A-Z]{3}$",
                              "description": "ISO 4217 three-letter currency code (e.g., EUR, USD)."
                            },
                            {
                              "type": "null",
                              "description": "Null where currency is not applicable."
                            }
                          ]
                        }
                      }
                    },
                    {
                      "type": "null",
                      "description": "Null where amount is not applicable."
                    }
                  ]
                },
                "category": {
                  "type": "string",
                  "description": "Category of shares or interest held. SHALL use one of the standardized values defined in Section 2.8.1 of the Ownership Rulebook.",
                  "enum": [
                    "ordinary",
                    "preferred",
                    "dual-class",
                    "other"
                  ]
                },
                "economic_rights": {
                  "type": "array",
                  "description": "Economic rights associated with the ownership interest. SHALL contain at least one value from Section 2.8.3 of the Ownership Rulebook.",
                  "minItems": 1,
                  "items": {
                    "type": "string",
                    "description": "Economic right type.",
                    "enum": [
                      "dividend_rights",
                      "liquidation_rights"
                    ]
                  }
                }
              }
            }
          }
        }
      }
    },
    "evidence": {
      "type": "array",
      "description": "List of supporting documentation substantiating the ownership structure calculation (e.g., shareholder register, organizational chart, trust deed). At least one piece of evidence SHALL be present. Evidence MAY be provided as a URI reference or as an embedded base64-encoded document.",
      "minItems": 1,
      "items": {
        "type": "object",
        "description": "A single piece of supporting evidence for the ownership structure.",
        "additionalProperties": false,
        "required": [
          "evidence_id",
          "evidence_type"
        ],
        "properties": {
          "evidence_id": {
            "type": "string",
            "minLength": 1,
            "description": "URI reference to the evidence document (e.g., organizational chart, shareholder register). The organization chart is made available through a dedicated link. If the Relying Party (RP) requires additional information regarding the organizational structure, it may download the relevant document and use it as supporting evidence for the ownership list calculation. SHALL be a non-empty string."
          },
          "evidence_type": {
            "type": "string",
            "description": "Defines the type of the object, which SHALL be 'Evidence'.",
            "const": "Evidence"
          },
          "evidence_data": {
            "type": "string",
            "description": "The actual organizational structure document as a base64-encoded string. This field is required if the 'evidence_id' does not contain a URI to an existing location where the organization structure content is available. Optional.",
            "contentEncoding": "base64"
          },
          "evidence_confirmation": {
            "type": "boolean",
            "description": "Boolean confirmation that the organizational structure document is current and has been used as the basis for the ownership calculation. Optional."
          },
          "evidence_date": {
            "type": "string",
            "format": "date",
            "description": "The date when the evidence document was created or last updated. SHALL follow ISO 8601 format (YYYY-MM-DD). Optional."
          }
        }
      }
    },
    "status": {
      "type": "object",
      "description": "Status object per SD-JWT VC status-list mechanism. MUST be present when the technical validity period is greater than 24 hours.",
      "additionalProperties": false,
      "required": [
        "type",
        "status_list_credential",
        "status_list_index",
        "status_purpose"
      ],
      "properties": {
        "type": {
          "type": "string",
          "description": "Status mechanism type. For SD-JWT VC Status List this SHALL be 'status-list'.",
          "const": "status-list"
        },
        "status_list_credential": {
          "type": "string",
          "format": "uri",
          "description": "URI of the Status List Credential that contains the bitstring indicating revocation status."
        },
        "status_list_index": {
          "type": "integer",
          "minimum": 0,
          "description": "Zero-based index into the status list bitstring for this credential."
        },
        "status_purpose": {
          "type": "string",
          "description": "Purpose of the status entry. For Ownership attestation this SHALL be 'revocation'.",
          "const": "revocation"
        }
      }
    },
    "trust_anchor_url": {
      "type": "string",
      "format": "uri",
      "description": "URL at which a machine-readable version of the trust anchor used for verifying the Ownership attestation can be found or looked up. Optional."
    },
    "schema_version": {
      "type": "string",
      "description": "Version of the Ownership attestation schema used. Optional.",
      "examples": [
        "0.3.0"
      ]
    },
    "cnf": {
      "type": "object",
      "description": "Confirmation claims per SD-JWT VC. Holder binding via JWK is recommended.",
      "additionalProperties": false,
      "properties": {
        "jwk": {
          "type": "object",
          "description": "Public key bound to the holder.",
          "additionalProperties": true,
          "properties": {
            "kty": { "type": "string" },
            "crv": { "type": "string" },
            "x": { "type": "string" },
            "y": { "type": "string" },
            "n": { "type": "string" },
            "e": { "type": "string" }
          }
        }
      },
      "required": [
        "jwk"
      ]
    }
  },
  "required": [
    "vct",
    "iss",
    "iat",
    "exp",
    "attestation_legal_category",
    "issuing_entity",
    "owner",
    "evidence"
  ]
}